{
  "paziente": {
    "assistito": {
      "codice_fiscale": "PNIMRA70A01H501P",
      "provincia": "AQ",
      "asl": "201"
    },
    "nome": "Paziente",
    "cognome": "Di Prova",
    "sesso": "M",
    "data_nascita": "1970-01-01",
    "luogo_nascita": {
      "comune": "Roma",
      "codice_istat_comune": "058091",
      "provincia": "RM",
      "codice_regione": "120",
      "stato": "100"
    },
    "residenza": {
      "comune": "L'Aquila",
      "codice_istat_comune": "066049",
      "via": "Via di Prova 1",
      "cap": "67100",
      "provincia": "AQ",
      "codice_regione": "130",
      "stato": "100"
    }
  },
  "autore": {
    "prescrittore": {
      "codice_fiscale": "PROVAX00X00X000Y",
      "codice_regione": "130",
      "codice_asl": "201",
      "codice_specializzazione": "F"
    },
    "nome": "Medico",
    "cognome": "Di Prova",
    "telefono": "0000000000",
    "email": "medico.di.prova@example.invalid",
    "titolo": "Dott.",
    "ruolo": "MMG"
  },
  "custode": {
    "id_radice": "2.16.840.1.113883.2.9.4.1.2",
    "id_estensione": "130201",
    "nome": "ASL DI PROVA 201 (dato di test)",
    "indirizzo": {
      "comune": "L'Aquila",
      "codice_istat_comune": "066049",
      "via": "Via di Prova 2",
      "codice_regione": "130",
      "stato": "100"
    }
  },
  "id_documento": "PSS-TEST-0003",
  "data": "2026-09-30T17:00:00",
  "allergie": [
    {
      "agente": "Amoxicillina",
      "agente_codice": "J01CA04",
      "agente_sistema": "ATC",
      "tipo": "DALLERGY",
      "inizio": "2015-03-01",
      "stato": "active"
    }
  ],
  "terapie": [
    {
      "descrizione": "Ramipril",
      "codice_atc": "C09AA05",
      "via": "PO",
      "inizio": "2020-01-10",
      "stato": "active"
    },
    {
      "descrizione": "LEVETIRACETAM 500MG 60 UNITA' USO ORALE",
      "codice_gruppo_equivalenza": "G3B",
      "via": "PO",
      "inizio": "2026-09-30",
      "stato": "active"
    }
  ],
  "problemi": [
    {
      "codice_icd9": "401.9",
      "descrizione": "Ipertensione essenziale non specificata",
      "inizio": "2020-01-10",
      "stato": "active"
    }
  ],
  "anamnesi_familiare": [
    {
      "parentela": "FTH",
      "codice_icd9": "410.00",
      "descrizione": "Infarto miocardico acuto",
      "sesso": "M",
      "eta_insorgenza": 60
    }
  ],
  "esenzioni": [
    {
      "codice": "031",
      "inizio": "2020-02-01",
      "stato": "active"
    }
  ],
  "versione": 1,
  "riservatezza": "N"
}